<?xml version="1.0" encoding="UTF-8"?>
<!-- EMPIRE input file -->
<EMPEROR xmlns="EmperorInput" xmlns:xsi="http://www.w3.org/2001/XMLSchema-instance"
	xsi:schemaLocation="EmperorInput http://empire.st.bv.tum.de/projects/empire/repository/revisions/master/raw/xmlSchema/emperorInput.xsd">

	<!-- ================ define clientCodes ======================================== -->
	<clientCode name="carat">
		<mesh name="myMesh1">
			<dataField name="displacements" location="atNode"
				dimension="vector" typeOfQuantity="field" />
			<dataField name="forces" location="atNode" dimension="vector"
				typeOfQuantity="fieldIntegral" />
		</mesh>
		<signal name="signal1" size="5" />
	</clientCode>
	<clientCode name="OpenFOAM">
		<mesh name="myMesh1">
			<dataField name="displacements" location="atNode"
				dimension="vector" typeOfQuantity="field" />
			<dataField name="tractionsElem" location="atElemCentroid"
				dimension="vector" typeOfQuantity="field" />
			<dataField name="tractionsNode" location="atNode"
				dimension="vector" typeOfQuantity="field" />
		</mesh>
		<signal name="signal1" size="5" />
	</clientCode>

	<!-- ================ define dataOutputs ======================================== -->
	<dataOutput name="timeStep" interval="5">
		<dataFieldRef clientCodeName="carat" meshName="myMesh1"
			dataFieldName="displacements" />
		<dataFieldRef clientCodeName="carat" meshName="myMesh1"
			dataFieldName="forces" />
		<dataFieldRef clientCodeName="OpenFOAM" meshName="myMesh1"
			dataFieldName="displacements" />
		<dataFieldRef clientCodeName="OpenFOAM" meshName="myMesh1"
			dataFieldName="tractionsElem" />
		<dataFieldRef clientCodeName="OpenFOAM" meshName="myMesh1"
			dataFieldName="tractionsNode" />
	</dataOutput>
	<dataOutput name="iterativeCoupling" interval="1">
		<dataFieldRef clientCodeName="carat" meshName="myMesh1"
			dataFieldName="displacements" />
		<dataFieldRef clientCodeName="carat" meshName="myMesh1"
			dataFieldName="forces" />
		<dataFieldRef clientCodeName="OpenFOAM" meshName="myMesh1"
			dataFieldName="displacements" />
		<dataFieldRef clientCodeName="OpenFOAM" meshName="myMesh1"
			dataFieldName="tractionsElem" />
		<dataFieldRef clientCodeName="OpenFOAM" meshName="myMesh1"
			dataFieldName="tractionsNode" />
	</dataOutput>
	<!-- ================ define mappers ============================================ -->
	<mapper name="mortar1" type="mortarMapper">
		<!-- mapping displacements from meshA to meshB, mapping forces from meshB 
			to meshA. -->
		<meshA>
			<meshRef clientCodeName="carat" meshName="myMesh1" />
		</meshA>
		<meshB>
			<meshRef clientCodeName="OpenFOAM" meshName="myMesh1" />
		</meshB>
		<mortarMapper oppositeSurfaceNormal="false" dual="true"
			enforceConsistency="true" />
	</mapper>
	<mapper name="nn" type="nearestNeighborMapper">
		<!-- mapping displacements from meshA to meshB, mapping forces from meshB 
			to meshA. -->
		<meshA>
			<meshRef clientCodeName="carat" meshName="myMesh1" />
		</meshA>
		<meshB>
			<meshRef clientCodeName="OpenFOAM" meshName="myMesh1" />
		</meshB>
	</mapper>
	<mapper name="bi" type="barycentricInterpolationMapper">
		<!-- mapping displacements from meshA to meshB, mapping forces from meshB 
			to meshA. -->
		<meshA>
			<meshRef clientCodeName="carat" meshName="myMesh1" />
		</meshA>
		<meshB>
			<meshRef clientCodeName="OpenFOAM" meshName="myMesh1" />
		</meshB>
	</mapper>
	<mapper name="IGAMortar1" type="IGAMortarMapper">	  
		<IGAMortarMapper tolProjectionDistance = "1e-6" numGPsTriangle="16" numGPsQuad="25" />
		<meshA>
			<meshRef clientCodeName="carat" meshName="myMesh1" />
		</meshA>
		<meshB>
			<meshRef clientCodeName="OpenFOAM" meshName="myMesh1" />
		</meshB>
	</mapper>
	

	<!-- ================ define couplingAlgorithms ================================== -->
	<couplingAlgorithm type="aitken" name="aitken">
		<aitken initialAitkenFactor="0.3" />
	</couplingAlgorithm>
	<couplingAlgorithm type="constantRelaxation" name="constantRelaxation">
		<constantRelaxation relaxationFactor="0.3" />
	</couplingAlgorithm>

	<!-- ================ define extrapolators ================================= -->
	<extrapolator type="simpleExtrapolator" name="simple" />
	<extrapolator name="displacement extrapolator" type="genMSExtrapolator">
		<genMSExtrapolator numInput="2" seqLen="1"
			sumOutput="false" deltaTime="3e-6">
			<coefficientDot0 value="1.0" />
			<coefficientDot1 value="0.5" />
		</genMSExtrapolator>
	</extrapolator>

	<!-- ================ define connections ========================================= -->
	<connection name="transfer displacements">
		<input>
			<dataFieldRef clientCodeName="carat" meshName="myMesh1"
				dataFieldName="displacements" />
		</input>
		<output>
			<dataFieldRef clientCodeName="OpenFOAM" meshName="myMesh1"
				dataFieldName="displacements" />
		</output>
		<sequence>
			<filter type="extrapolatingFilter">
				<inputAndOutput>
					<dataFieldRef clientCodeName="carat" meshName="myMesh1"
						dataFieldName="displacements" />
				</inputAndOutput>
				<extrapolatingFilter>
					<extrapolatorRef extrapolatorName="simple" />
				</extrapolatingFilter>
			</filter>
			<filter type="couplingAlgorithmFilter">
				<input>
					<dataFieldRef clientCodeName="carat" meshName="myMesh1"
						dataFieldName="displacements" />
				</input>
				<output>
					<dataFieldRef clientCodeName="carat" meshName="myMesh1"
						dataFieldName="displacements" />
				</output>
				<couplingAlgorithmFilter>
					<couplingAlgorithmRef couplingAlgorithmName="aitken" />
				</couplingAlgorithmFilter>
			</filter>
			<filter type="mappingFilter">
				<input>
					<dataFieldRef clientCodeName="carat" meshName="myMesh1"
						dataFieldName="displacements" />
				</input>
				<output>
					<dataFieldRef clientCodeName="OpenFOAM" meshName="myMesh1"
						dataFieldName="displacements" />
				</output>
				<mappingFilter>
					<mapperRef mapperName="mortar1" />
				</mappingFilter>
			</filter>
		</sequence>
	</connection>
	<connection name="transfer forces">
		<input>
			<dataFieldRef clientCodeName="OpenFOAM" meshName="myMesh1"
				dataFieldName="tractionsElem" />
		</input>
		<output>
			<dataFieldRef clientCodeName="carat" meshName="myMesh1"
				dataFieldName="forces" />
		</output>
		<sequence>
			<filter type="locationFilter">
				<input>
					<dataFieldRef clientCodeName="OpenFOAM" meshName="myMesh1"
						dataFieldName="tractionsElem" />
				</input>
				<output>
					<dataFieldRef clientCodeName="OpenFOAM" meshName="myMesh1"
						dataFieldName="tractionsNode" />
				</output>
			</filter>
			<filter type="mappingFilter">
				<input>
					<dataFieldRef clientCodeName="OpenFOAM" meshName="myMesh1"
						dataFieldName="tractionsNode" />
				</input>
				<output>
					<dataFieldRef clientCodeName="carat" meshName="myMesh1"
						dataFieldName="forces" />
				</output>
				<mappingFilter>
					<mapperRef mapperName="mortar1" />
				</mappingFilter>
			</filter>
		</sequence>
	</connection>
	

	<connection name="transfer signal1">
		<input>
			<signalRef clientCodeName="ping" signalName="signal1" />
		</input>
		<output>
			<signalRef clientCodeName="pong" signalName="signal1" />
		</output>
		<sequence>
			<filter type="copyFilter">
				<input>
					<signalRef clientCodeName="ping" signalName="signal1" />
				</input>
				<output>
					<signalRef clientCodeName="pong" signalName="signal1" />
				</output>
			</filter>
			<filter type="scalingFilter">
				<inputAndOutput>
					<signalRef clientCodeName="pong" signalName="signal1" />
				</inputAndOutput>
				<scalingFilter factor="-1.0" />
			</filter>
		</sequence>
	</connection>
    <connection name="set initial value">
		<sequence>
			<filter type="setFilter">
				<inputAndOutput>
					<signalRef clientCodeName="generatorUnit" signalName="forcesRotorMoment" />
				</inputAndOutput>
				<setFilter value="0.0 1.0 2.0" />
	        </filter>
	   </sequence>
	</connection>
	<!-- ================ define coSimulation process ================================ -->
	<coSimulation>
		<sequence>
			<couplingLogic type="timeStepLoop">
				<timeStepLoop numTimeSteps="1000">
					<extrapolatorRef extrapolatorName="simple" />
					<dataOutputRef dataOutputName="timeStep" />
				</timeStepLoop>
				<sequence>
					<couplingLogic type="iterativeCouplingLoop">
						<iterativeCouplingLoop>
							<convergenceChecker absoluteTolerance="1E-8"
								relativeTolerance="1E-4" maxNumOfIterations="1000">
								<dataFieldRef clientCodeName="carat" meshName="myMesh1"
									dataFieldName="displacements" />
							</convergenceChecker>
							<convergenceObserver>
								<clientCodeRef clientCodeName="carat" />
							</convergenceObserver>
							<convergenceObserver>
								<clientCodeRef clientCodeName="OpenFOAM" />
							</convergenceObserver>
							<couplingAlgorithmRef couplingAlgorithmName="aitken" />
							<dataOutputRef dataOutputName="iterativeCoupling" />
						</iterativeCouplingLoop>
						<sequence>
							<couplingLogic type="connection">
								<connectionRef connectionName="transfer displacements" />
							</couplingLogic>
							<couplingLogic type="connection">
								<connectionRef connectionName="transfer forces" />
							</couplingLogic>
						</sequence>
					</couplingLogic>
					<couplingLogic type="connection">
						<connectionRef connectionName="transfer signal1" />
					</couplingLogic>
				</sequence>
			</couplingLogic>
		</sequence>
	</coSimulation>

	<!-- ================ general block ============================================== -->
	<general>
		<portFile>server.port</portFile>
		<verbosity>debug</verbosity>
	</general>
</EMPEROR>